{
  "artifacts": [
    {
      "git_blob": "0dfdb8b5301d56c60b8b06b4529287237438dd65",
      "mode": "100644",
      "path": "README.md",
      "sha256": "ba03510e559c3e7a62fe7bd60b5c5805450fa80739780667dd983b1d19303cf6"
    },
    {
      "git_blob": "e6e59d4a964eddab346e20a53f2f76e0de10c177",
      "mode": "100644",
      "path": "docs/HIOC_MASTER_PLAN.md",
      "sha256": "898490265967a3ca1fabfcd2966b41186224bbb987d3c7487adc6cbb92f2ff93"
    },
    {
      "git_blob": "7b24fe1ee823da0fcd4af38078a03d0d68fd0205",
      "mode": "100644",
      "path": "docs/HIOC_PROJECT_CONTEXT.md",
      "sha256": "68e4d5696a9951fcd7958d0ffc8a3b005085d84db14b28fb11aa124e098ff58f"
    },
    {
      "git_blob": "582da069fccf159e5a9a27891e8098d9d3934f98",
      "mode": "100644",
      "path": "governance/continuity/engineering-transition-issue-6.md",
      "sha256": "f360b404ce8cd30a508184586de20ef916de1af20d47a2430bf4ef97252e173e"
    },
    {
      "git_blob": "daf34f62746725e71733ed9a3e74c244c64685b4",
      "mode": "100644",
      "path": "governance/continuity/t1-authorization.md",
      "sha256": "921efc47c3cb921a413132c6eca30a49ce721fbe0fd7f548d6818a2b56d1eca7"
    },
    {
      "git_blob": "251869df9ee754da75a967290a64a8ff01cf0878",
      "mode": "100644",
      "path": "tests/test_pe5_service_association_caller.py",
      "sha256": "4ba9c223a622c645c67f05690f4fab9f41bf0c8ad07ff2ba1ae5b79532244ac0"
    },
    {
      "git_blob": "d6a49a4b3306ee854aed9bbc7cbe7930aec13cf5",
      "mode": "100644",
      "path": "tests/test_pe6_classification_implementation.py",
      "sha256": "d2ee35d4e7b589b2296372417ea93fd169ff827e080adfd1f6a5bcd2a11a5ec5"
    },
    {
      "git_blob": "a0a0976663dfafe3bde13c368c3eb6d46e85adbc",
      "mode": "100644",
      "path": "tests/test_project_continuity.py",
      "sha256": "93bc72bc0eda10360b4896cc7622d9a29458505e589d496ef738db20c07997ba"
    },
    {
      "git_blob": "a370d2ca3b78f816f8006b47d1f21468c7ee14ea",
      "mode": "100644",
      "path": "tools/hioc-project-context.py",
      "sha256": "e153685879b817ef7e6f8a0500cfdca99485d1f13346562e377c020a1897ce90"
    },
    {
      "git_blob": "a607d48140c076bbc68aa6abe88292d11bf23ade",
      "mode": "100644",
      "path": "tools/hioc_project_continuity.py",
      "sha256": "f8ec935de077266561457e8cf9c4b4fe9a6192e2ed7268e9882c86f58242ef58"
    }
  ],
  "authorities": {
    "architecture": "docs/ARCHITECTURE.md",
    "data": "docs/DATA_MODEL.md",
    "deployment": "docs/DEPLOYMENT.md",
    "home_assistant": "docs/HOME_ASSISTANT.md",
    "mqtt": "docs/MQTT.md",
    "overview": "docs/PROJECT.md",
    "pe6_design": "docs/PE6_CLASSIFICATION_CONTRACT_DESIGN.md",
    "pe6_implementation": "docs/PE6_CLASSIFICATION_IMPLEMENTATION.md",
    "product_plan": "docs/HIOC_MASTER_PLAN.md",
    "runtime": "docs/OPERATIONS.md",
    "system": "docs/SYSTEM_REFERENCE.md"
  },
  "authorized_paths": [
    "README.md",
    "docs/HIOC_MASTER_PLAN.md",
    "docs/HIOC_PROJECT_CONTEXT.md",
    "governance/continuity/engineering-transition-issue-6.md",
    "governance/continuity/project-handoff.json",
    "governance/continuity/project-handoff.schema.json",
    "governance/continuity/t1-authorization.md",
    "tests/test_pe5_service_association_caller.py",
    "tests/test_pe6_classification_implementation.py",
    "tests/test_project_continuity.py",
    "tools/hioc-project-context.py",
    "tools/hioc_project_continuity.py"
  ],
  "blockers": [],
  "boundary": {
    "codex": "WINDOWS_REPOSITORY_ONLY",
    "credential_access": false,
    "ha_access": false,
    "mqtt_access": false,
    "pi3_access": false,
    "pi3_execution": "OPERATOR_ONLY_SEPARATE_AUTHORIZATION",
    "pi5_access": false,
    "production_access": false,
    "production_current_state": "UNKNOWN",
    "production_mutation": false
  },
  "last_verified": {
    "branch": "main",
    "clean": true,
    "commit": "94f014cea1d5216a1deeef9fd1d0a025f1c7083e",
    "evidence_class": "DIRECT_OBSERVATION",
    "head_equals_origin_main": true,
    "limitation": "HISTORICAL_OBSERVATION; REVERIFY_LIVE_STATE",
    "scope": "WINDOWS_REPOSITORY_AT_T1_START"
  },
  "pending_work": [
    "T2 through T5: separate authorization",
    "PE-6.2: separate authorization",
    "Phase 7B Active Discovery postponed"
  ],
  "product": {
    "accepted_checkpoint": "PE-6.1 COMPLETE/PASS",
    "accepted_commit": "94f014cea1d5216a1deeef9fd1d0a025f1c7083e",
    "next_authorized": false,
    "next_checkpoint": "PE-6.2 - PI3 Release-Source Synchronization",
    "pe6_production_deployed_at_closure": false,
    "phase": "Phase 7A ACTIVE"
  },
  "project": "HIOC",
  "recovery": {
    "accepted_unpublished_candidate": false,
    "candidate_state": "DERIVE_FROM_FRESH_GIT",
    "dirty_candidate": "PRESERVE_AND_COMPARE; NEVER_RESET_OR_OVERWRITE",
    "freshness": "VERIFY_ALL_CURRENT_BYTES_AND_INDEX_EVERY_CALL; HISTORICAL_MODE_IS_SNAPSHOT_ONLY",
    "unavailable_repository": "UNKNOWN_STOP; REQUEST_FILES_OR_VERIFIED_EXPORT"
  },
  "repository": "https://github.com/jorgeazofeifa-creator/hioc",
  "schema_version": "1.0",
  "transition": {
    "immediate_after_acceptance": "STOP; T2 requires separate authorization",
    "implementation": "COMPLETE_REPOSITORY_IMPLEMENTATION",
    "next_stage": "T2",
    "next_stage_authorized": false,
    "publication": "VERIFY_FROM_GIT_NOT_THIS_RECORD",
    "sequence": [
      "T1 continuity",
      "T2 binding audit",
      "T3 deterministic CI/test environments",
      "T4 bounded capability pilot",
      "T5 evidence-based consolidation"
    ],
    "stage": "T1"
  },
  "unknowns": [
    "Current production state",
    "Future checkpoint authorization"
  ]
}
